2026-01-20 17:57:34,102 - 
==================================================
2026-01-20 17:57:34,102 - STARTING PIPELINE: resnet50
2026-01-20 17:57:34,102 - Timestamp: 20260120_175734
2026-01-20 17:57:34,102 - ==================================================
2026-01-20 17:57:34,102 - CONFIGURATION:
2026-01-20 17:57:34,102 -   - Model: resnet50
2026-01-20 17:57:34,102 -   - LR: 0.00026
2026-01-20 17:57:34,102 -   - Augmentation: False
2026-01-20 17:57:34,102 -   - Optimizer: adamw
2026-01-20 17:57:34,102 -   - Device: cuda
2026-01-20 17:57:34,102 - 
Loading DataLoaders...
2026-01-20 17:57:34,119 - Downloading/Loading model architecture: resnet50...
2026-01-20 17:57:34,578 - Using AdamW Optimizer
2026-01-20 17:57:34,579 - 
Epoch 1/5
2026-01-20 17:57:53,437 - -----------------------------------------------------------------
2026-01-20 17:57:53,437 - METRIC     | TRAIN      | VALIDATION
2026-01-20 17:57:53,437 - -----------------------------------------------------------------
2026-01-20 17:57:53,437 - Loss       | 0.2112     | 0.0612
2026-01-20 17:57:53,437 - Accuracy   | 0.9321     | 0.9693
2026-01-20 17:57:53,437 - F1 Score   | 0.9542     | 0.9780
2026-01-20 17:57:53,437 - Recall     | 0.9481     | 0.9569
2026-01-20 17:57:53,437 - Precision  | 0.9604     | 1.0000
2026-01-20 17:57:53,437 - -----------------------------------------------------------------
2026-01-20 17:57:54,266 - --> 🏆 New Best Model saved to best_model_resnet50_20260120_175734.pth
2026-01-20 17:57:54,266 - 
Epoch 2/5
2026-01-20 17:58:12,320 - -----------------------------------------------------------------
2026-01-20 17:58:12,320 - METRIC     | TRAIN      | VALIDATION
2026-01-20 17:58:12,320 - -----------------------------------------------------------------
2026-01-20 17:58:12,320 - Loss       | 0.0722     | 0.1065
2026-01-20 17:58:12,321 - Accuracy   | 0.9759     | 0.9731
2026-01-20 17:58:12,321 - F1 Score   | 0.9837     | 0.9813
2026-01-20 17:58:12,321 - Recall     | 0.9757     | 0.9892
2026-01-20 17:58:12,321 - Precision  | 0.9919     | 0.9735
2026-01-20 17:58:12,321 - -----------------------------------------------------------------
2026-01-20 17:58:13,158 - --> 🏆 New Best Model saved to best_model_resnet50_20260120_175734.pth
2026-01-20 17:58:13,158 - 
Epoch 3/5
2026-01-20 17:58:31,707 - -----------------------------------------------------------------
2026-01-20 17:58:31,707 - METRIC     | TRAIN      | VALIDATION
2026-01-20 17:58:31,707 - -----------------------------------------------------------------
2026-01-20 17:58:31,707 - Loss       | 0.0482     | 0.0545
2026-01-20 17:58:31,707 - Accuracy   | 0.9847     | 0.9770
2026-01-20 17:58:31,707 - F1 Score   | 0.9897     | 0.9836
2026-01-20 17:58:31,708 - Recall     | 0.9849     | 0.9677
2026-01-20 17:58:31,708 - Precision  | 0.9945     | 1.0000
2026-01-20 17:58:31,708 - -----------------------------------------------------------------
2026-01-20 17:58:32,547 - --> 🏆 New Best Model saved to best_model_resnet50_20260120_175734.pth
2026-01-20 17:58:32,547 - 
Epoch 4/5
2026-01-20 17:58:50,574 - -----------------------------------------------------------------
2026-01-20 17:58:50,574 - METRIC     | TRAIN      | VALIDATION
2026-01-20 17:58:50,574 - -----------------------------------------------------------------
2026-01-20 17:58:50,574 - Loss       | 0.0322     | 0.0398
2026-01-20 17:58:50,574 - Accuracy   | 0.9883     | 0.9846
2026-01-20 17:58:50,574 - F1 Score   | 0.9921     | 0.9891
2026-01-20 17:58:50,574 - Recall     | 0.9886     | 0.9811
2026-01-20 17:58:50,574 - Precision  | 0.9957     | 0.9973
2026-01-20 17:58:50,574 - -----------------------------------------------------------------
2026-01-20 17:58:51,410 - --> 🏆 New Best Model saved to best_model_resnet50_20260120_175734.pth
2026-01-20 17:58:51,410 - 
Epoch 5/5
2026-01-20 17:59:09,980 - -----------------------------------------------------------------
2026-01-20 17:59:09,980 - METRIC     | TRAIN      | VALIDATION
2026-01-20 17:59:09,980 - -----------------------------------------------------------------
2026-01-20 17:59:09,980 - Loss       | 0.0172     | 0.0678
2026-01-20 17:59:09,981 - Accuracy   | 0.9957     | 0.9770
2026-01-20 17:59:09,981 - F1 Score   | 0.9971     | 0.9838
2026-01-20 17:59:09,981 - Recall     | 0.9966     | 0.9838
2026-01-20 17:59:09,981 - Precision  | 0.9977     | 0.9838
2026-01-20 17:59:09,981 - -----------------------------------------------------------------
2026-01-20 17:59:09,981 - 
--- Training Loop Complete ---

2026-01-20 17:59:09,981 - ==================================================
2026-01-20 17:59:09,981 - FINAL TEST: EVALUATING BEST MODEL ON UNSEEN DATA
2026-01-20 17:59:09,981 - ==================================================
2026-01-20 17:59:09,981 - Loading best weights from: best_model_resnet50_20260120_175734.pth
2026-01-20 17:59:13,771 - 
📢 FINAL RESULTS FOR RESNET50:
2026-01-20 17:59:13,771 - Accuracy:  0.8734
2026-01-20 17:59:13,771 - Recall:    0.9897
2026-01-20 17:59:13,771 - Precision: 0.8373
2026-01-20 17:59:13,772 - F1 Score:  0.9072
2026-01-20 17:59:13,772 - ==================================================

