2026-01-20 17:52:13,226 - 
==================================================
2026-01-20 17:52:13,226 - STARTING PIPELINE: vit_base_patch16_224
2026-01-20 17:52:13,226 - Timestamp: 20260120_175213
2026-01-20 17:52:13,226 - ==================================================
2026-01-20 17:52:13,226 - CONFIGURATION:
2026-01-20 17:52:13,227 -   - Model: vit_base_patch16_224
2026-01-20 17:52:13,227 -   - LR: 1.1e-05
2026-01-20 17:52:13,227 -   - Augmentation: False
2026-01-20 17:52:13,227 -   - Optimizer: adamw
2026-01-20 17:52:13,227 -   - Device: cuda
2026-01-20 17:52:13,227 - 
Loading DataLoaders...
2026-01-20 17:52:13,244 - Downloading/Loading model architecture: vit_base_patch16_224...
2026-01-20 17:52:14,411 - Using AdamW Optimizer
2026-01-20 17:52:14,412 - 
Epoch 1/5
2026-01-20 17:52:54,978 - -----------------------------------------------------------------
2026-01-20 17:52:54,978 - METRIC     | TRAIN      | VALIDATION
2026-01-20 17:52:54,978 - -----------------------------------------------------------------
2026-01-20 17:52:54,978 - Loss       | 0.1452     | 0.0516
2026-01-20 17:52:54,979 - Accuracy   | 0.9436     | 0.9770
2026-01-20 17:52:54,979 - F1 Score   | 0.9613     | 0.9836
2026-01-20 17:52:54,979 - Recall     | 0.9395     | 0.9677
2026-01-20 17:52:54,979 - Precision  | 0.9842     | 1.0000
2026-01-20 17:52:54,979 - -----------------------------------------------------------------
2026-01-20 17:52:57,945 - --> 🏆 New Best Model saved to best_model_vit_base_patch16_224_20260120_175213.pth
2026-01-20 17:52:57,945 - 
Epoch 2/5
2026-01-20 17:53:38,292 - -----------------------------------------------------------------
2026-01-20 17:53:38,292 - METRIC     | TRAIN      | VALIDATION
2026-01-20 17:53:38,292 - -----------------------------------------------------------------
2026-01-20 17:53:38,292 - Loss       | 0.0454     | 0.0345
2026-01-20 17:53:38,293 - Accuracy   | 0.9830     | 0.9846
2026-01-20 17:53:38,293 - F1 Score   | 0.9885     | 0.9891
2026-01-20 17:53:38,293 - Recall     | 0.9812     | 0.9811
2026-01-20 17:53:38,293 - Precision  | 0.9959     | 0.9973
2026-01-20 17:53:38,293 - -----------------------------------------------------------------
2026-01-20 17:53:41,280 - --> 🏆 New Best Model saved to best_model_vit_base_patch16_224_20260120_175213.pth
2026-01-20 17:53:41,280 - 
Epoch 3/5
2026-01-20 17:54:21,819 - -----------------------------------------------------------------
2026-01-20 17:54:21,819 - METRIC     | TRAIN      | VALIDATION
2026-01-20 17:54:21,819 - -----------------------------------------------------------------
2026-01-20 17:54:21,819 - Loss       | 0.0253     | 0.0502
2026-01-20 17:54:21,819 - Accuracy   | 0.9906     | 0.9866
2026-01-20 17:54:21,819 - F1 Score   | 0.9937     | 0.9906
2026-01-20 17:54:21,819 - Recall     | 0.9897     | 0.9919
2026-01-20 17:54:21,819 - Precision  | 0.9977     | 0.9892
2026-01-20 17:54:21,819 - -----------------------------------------------------------------
2026-01-20 17:54:24,809 - --> 🏆 New Best Model saved to best_model_vit_base_patch16_224_20260120_175213.pth
2026-01-20 17:54:24,809 - 
Epoch 4/5
2026-01-20 17:55:05,385 - -----------------------------------------------------------------
2026-01-20 17:55:05,385 - METRIC     | TRAIN      | VALIDATION
2026-01-20 17:55:05,385 - -----------------------------------------------------------------
2026-01-20 17:55:05,385 - Loss       | 0.0194     | 0.0708
2026-01-20 17:55:05,385 - Accuracy   | 0.9925     | 0.9808
2026-01-20 17:55:05,385 - F1 Score   | 0.9950     | 0.9866
2026-01-20 17:55:05,385 - Recall     | 0.9926     | 0.9892
2026-01-20 17:55:05,385 - Precision  | 0.9974     | 0.9839
2026-01-20 17:55:05,385 - -----------------------------------------------------------------
2026-01-20 17:55:05,385 - 
Epoch 5/5
2026-01-20 17:55:45,993 - -----------------------------------------------------------------
2026-01-20 17:55:45,993 - METRIC     | TRAIN      | VALIDATION
2026-01-20 17:55:45,993 - -----------------------------------------------------------------
2026-01-20 17:55:45,993 - Loss       | 0.0222     | 0.0431
2026-01-20 17:55:45,993 - Accuracy   | 0.9913     | 0.9904
2026-01-20 17:55:45,993 - F1 Score   | 0.9941     | 0.9933
2026-01-20 17:55:45,994 - Recall     | 0.9909     | 0.9919
2026-01-20 17:55:45,994 - Precision  | 0.9974     | 0.9946
2026-01-20 17:55:45,994 - -----------------------------------------------------------------
2026-01-20 17:55:48,982 - --> 🏆 New Best Model saved to best_model_vit_base_patch16_224_20260120_175213.pth
2026-01-20 17:55:48,982 - 
--- Training Loop Complete ---

2026-01-20 17:55:48,982 - ==================================================
2026-01-20 17:55:48,982 - FINAL TEST: EVALUATING BEST MODEL ON UNSEEN DATA
2026-01-20 17:55:48,982 - ==================================================
2026-01-20 17:55:48,982 - Loading best weights from: best_model_vit_base_patch16_224_20260120_175213.pth
2026-01-20 17:55:54,551 - 
📢 FINAL RESULTS FOR VIT_BASE_PATCH16_224:
2026-01-20 17:55:54,551 - Accuracy:  0.7917
2026-01-20 17:55:54,551 - Recall:    1.0000
2026-01-20 17:55:54,551 - Precision: 0.7500
2026-01-20 17:55:54,551 - F1 Score:  0.8571
2026-01-20 17:55:54,551 - ==================================================

